Title,URL,Description,Source
"The latest AI news we announced in December - Google Blog","https://blog.google/technology/ai/google-ai-updates-december-2024/","Dec 20, 2024 · Google made significant strides in AI in December, releasing Gemini 2.0, their most capable model yet, and introducing new AI video and image generation models.","blog.google"
"AI Update, December 13, 2024: AI News and Views From the Past Week","https://www.marketingprofs.com/opinions/2024/52468/ai-update-december-13-2024-ai-news-and-views-from-the-past-week","Dec 13, 2024 · Google unveiled updates to its Gemini 2 AI model, enhancing capabilities for multimodal processing, AR applications, and autonomous decision- ...","www.marketingprofs.com"
"AI News | Latest Headlines and Developments | Reuters","https://www.reuters.com/technology/artificial-intelligence/","Nov 18, 2025 ·   Explore the <em>latest</em> artificial intelligence news with <em>Reuters</em> - from <em>AI</em> <em>breakthroughs</em> and technology trends to regulation, ethics, business and global impact. ","www.reuters.com"
"Emerging AI&apos;s Year End: Roundup for November and December 2024","https://www.ptechpartners.com/2025/01/02/emerging-ais-year-end-roundup-for-november-and-december-2024/","Jan 2, 2025 · Explore the key AI advancements and trends from November and December 2024, covering breakthroughs, regulatory updates, and insights shaping ...","www.ptechpartners.com"
"6 Game-Changing AI Breakthroughs That Defined 2024 - Forbes","https://www.forbes.com/sites/bernardmarr/2024/12/16/6-game-changing-ai-breakthroughs-that-defined-2024/","Dec 16, 2024 · Here, we explore seven pivotal AI developments, including historic regulatory frameworks and Nobel Prize-winning breakthroughs, that are ...","www.forbes.com"